Movie Spanish,Movie Name real,mi_info,Year,Runtime,Genre,Rating,Director,Language,Country,sinopsis,plataformas,links_plataformas
¡Qué bello es vivir!,¡Qué bello es vivir!,43,1946,129,"Drama, Familia, Fantasía",8.3,Frank Capra,en,United States of America,"George Bailey es un honrado y modesto ciudadano que dirige y mantiene a flote un pequeño banco familiar, a pesar de los intentos de un poderoso banquero por arruinarlo. El dia de Nochebuena de 1945, abrumado por la repentina desaparición de una importante suma de dinero, que supondría no solo la quiebra de su banco sino también un gran escándalo, decide suicidarse, pero cuando está a punto de hacerlo ocurre algo extraordinario.","Movistar Plus+ Ficción Total , Movistar Plus+, Filmin",https://www.themoviedb.org/movie/1585-it-s-a-wonderful-life/watch?locale=ES
¿Teléfono rojo? volamos hacia moscú,¿Teléfono rojo? Volamos hacia Moscú,74,1964,95,"Comedia, Bélica",8.119,Stanley Kubrick,en,"United Kingdom, United States of America","Convencido de que los comunistas están contaminando los Estados Unidos, un general ordena, en un acceso de locura, un ataque aéreo nuclear sorpresa contra la Unión Soviética. Su ayudante, el capitán Mandrake, trata de encontrar la fórmula para impedir el bombardeo. Por su parte, el presidente de los EE.UU. se pone en contacto con Moscú para convencer al gobierno soviético de que el ataque no es más que un estúpido error. Mientras tanto, el asesor estadounidense, un antiguo científico nazi, el doctor Strangelove, confirma la existencia de la «Máquina del Juicio Final», un dispositivo de represalia soviético capaz de acabar con la humanidad para siempre.","Movistar Plus+ Ficción Total , Movistar Plus+, Filmin",https://www.themoviedb.org/movie/935-dr-strangelove-or-how-i-learned-to-stop-worrying-and-love-the-bomb/watch?locale=ES
10.000 km,10.000 km,,2014,98,"Drama, Romance",6.1,Carlos Marques-Marcet,es,Spain,"¿Amor y distancia son incompatibles? ¿Puede el amor sobrevivir a 10.000 kilómetros de separación? Alexandra y Sergio se quieren. De hecho, están preparados para tener un hijo. Pero todo cambia cuando a ella le ofrecen un contrato durante un año en Los Ángeles. Esta puede ser su última oportunidad para realzar su estancada carrera fotográfica, y acepta. Mientras tanto, Sergio continúa viviendo en Barcelona.",Filmin,https://www.themoviedb.org/movie/253251-10-000-km/watch?locale=ES
100 Nights Of Hero,100 Nights of Hero,LGTB,2025,91,"Fantasía, Romance",6.0,Julia Jackman,en,"United Kingdom, United States of America","Dos mujeres casadas, Cherry y Hero, idean un ingenioso plan para disuadir al lascivo Manfred de seducir a Cherry después de apostar con el esposo de ella. Hero cautiva a Manfred con relatos fascinantes durante cien noches.",,
120 latidos por minuto,120 pulsaciones por minuto,LGTB,2017,142,Drama,7.701,Robin Campillo,fr,France,"París, principios de los años 90. Un grupo de jóvenes activistas intenta generar conciencia sobre el SIDA. Un nuevo miembro del grupo, Nathan, se quedará sorprendido ante la radicalidad y energía de Sean, que gasta su último aliento en la lucha.",Filmin,https://www.themoviedb.org/movie/451945-120-battements-par-minute/watch?locale=ES
16 wishes,16 deseos,hillary duff,2010,90,"Fantasía, Drama, Familia",6.32,Peter DeLuise,en,United States of America,"Ansiosa por hacerse mayor, Abby ha estado planeando su decimosexto cumpleaños desde que era niña y ha mantenido en secreto una lista de deseos que le gustaría que se hiciesen realidad. Cuando el gran día finalmente llega, todo parece salir mal. Pero entonces una misteriosa caja de velas de cumpleaños mágicas llega para cambiar las cosas y los 16 deseos de Abby empiezan a hacerse realidad.",,
28 semanas despues,28 semanas después,zombies,2007,96,"Terror, Suspense, Ciencia ficción",6.607,Juan Carlos Fresnadillo,en,"United Kingdom, Spain, United States of America","Seis meses después de que la propagación del virus haya aniquilado las Islas Británicas, el ejército de los Estados Unidos declara que ha ganado la guerra contra la infección y que puede comenzar la reconstrucción del país. Con la primera ola de refugiados que vuelve al país, una familia consigue reencontrarse. Pero uno de los miembros guarda un terrible secreto sin ser consciente de ello. El virus aún no ha sido destruido y en esta ocasión, es más peligroso que nunca.",Disney Plus,https://www.themoviedb.org/movie/1562-28-weeks-later/watch?locale=ES
300,300,,2007,117,"Acción, Aventura, Bélica",7.2,Zack Snyder,en,United States of America,"Adaptación del cómic de Frank Miller (autor del cómic 'Sin City') sobre la famosa batalla de las Termópilas (480 a.C.). El objetivo de Jerjes, emperador de Persia, era la conquista de Grecia, lo que desencadenó las Guerras Médicas. Dada la gravedad de la situación, el rey Leónidas de Esparta (Gerard Butler) y 300 espartanos se enfrentaron a un ejército persa que era inmensamente superior.","Movistar Plus+ Ficción Total , Movistar Plus+, HBO Max Amazon Channel, HBO Max",https://www.themoviedb.org/movie/1271-300/watch?locale=ES
4th man out,4th Man Out,LGTB,2015,86,"Comedia, Drama",6.857,Andrew Nackman,en,United States of America,Un mecánico de coches en una pequeña localidad de clase obrera sale del armario para sorpresa de sus mejores amigos.,,https://www.themoviedb.org/movie/342672-4th-man-out/watch?locale=ES
8 1/2,El Gato con Botas: El último deseo,102,2022,103,"Animación, Aventura, Fantasía, Comedia, Familia",8.207,Joel Crawford,en,United States of America,El Gato con Botas se embarca en un viaje épico para encontrar al mítico Último Deseo y recuperar sus nueve vidas.,"Netflix Standard with Ads, Netflix",https://www.themoviedb.org/movie/315162-puss-in-boots-the-last-wish/watch?locale=ES
A secret love,La casa de las dagas voladoras,LGTB,2004,114,"Aventura, Drama, Acción",7.265,Zhang Yimou,zh,"China, Hong Kong","Corre el año 859 a.C. y la dinastía Tang, una vez floreciente, ha entrado en decadencia. El malestar se extiende por todo el país, y el corrupto gobierno tiene que enfrentarse en todas partes con ejércitos rebeldes. El más poderoso es el de la ""Casa de las Dagas Voladoras"", que se está haciendo cada vez más fuerte gracias a un nuevo y misterioso líder. Dos capitanes, Leo y Jin, reciben la orden de capturarlo y para ello elaboran un minucioso plan. El capitán Jin finge ser un guerrero solitario llamado Viento y saca de prisión a la revolucionaria ciega Mei, que lo llevará hasta el cuartel general de la Casa de las Dagas Voladoras, pero durante el viaje, Jin y Mei se enamoran profundamente.",,
A silent voice,A Silent Voice,,2016,130,"Animación, Drama, Romance",8.388,Naoko Yamada,ja,Japan,"Shōko, una niña con discapacidad auditiva, es víctima de acoso en su escuela, siendo Shōya su principal agresor. Cuando ella se cambia de colegio, él sufre el rechazo de sus compañeros y queda aislado. Años después, intenta enmendar su error y hacer las paces con Shōko.","Crunchyroll Amazon Channel, Crunchyroll",https://www.themoviedb.org/movie/378064/watch?locale=ES
A tale of two sisters,Dos hermanas,plot twist,2003,114,"Drama, Terror, Misterio",7.098,Kim Jee-woon,ko,South Korea,"Dos hermanas llegan a la nueva casa que su padre viudo comparte con su nueva esposa. La creciente crueldad de la madrastra, unida a las apariciones del fantasma de la madre de las jóvenes, irá creando una atmósfera inquietante. (FILMAFFINITY)","Amazon Prime Video, Amazon Prime Video with Ads, Filmin",https://www.themoviedb.org/movie/4552/watch?locale=ES
Ablution,Ablution,LGTB,2017,15,Drama,1.0,Omar Al Dakheel,en,United States of America,,,
Adam,Black Adam,,2022,124,"Acción, Aventura, Ciencia ficción",6.8,Jaume Collet-Serra,en,United States of America,"Casi 5000 años después de que los dioses antiguos le concediesen sus poderes y tras ser encarcelado, Black Adam queda liberado de su tumba terrenal y está listo para hacer justicia a su manera en el mundo moderno.","Movistar Plus+ Ficción Total , HBO Max, HBO Max Amazon Channel",https://www.themoviedb.org/movie/436270-black-adam/watch?locale=ES
Adaptation,Adaptation. El ladrón de orquídeas,,2002,116,"Comedia, Crimen, Drama",7.336,Spike Jonze,en,United States of America,"Charlie Kaufman, un guionista de Los Ángeles, vive un periodo de crisis creativa, todo lo contrario que su hermano gemelo Donald. Charlie escribe tal como vive: con gran dificultad y lleno de inseguridades, mientras que Donald vive tal como escribe: con dejadez. Por su parte, Susan escribe sobre la vida, pero es incapaz de vivirla. Por el contrario, la intensa y aventurera vida de John es digna de una novela.","Movistar Plus+ Ficción Total , Movistar Plus+",https://www.themoviedb.org/movie/2757-adaptation/watch?locale=ES
Agárralo como puedas,Agárralo como puedas,,2025,85,"Acción, Comedia, Crimen",6.4,Akiva Schaffer,en,United States of America,"El torpe teniente Frank Drebin Jr. intenta resolver un asesinato vinculado a un magnate tecnológico. Mientras investiga, su unidad policial corre peligro de ser cerrada. Con la ayuda de una escritora de crímenes, Frank se verá envuelto en situaciones tan absurdas como explosivas. Película reboot basada en la popular franquicia de comedia ""Agárralo como puedas"" y la serie de televisión ""Police Squad!"".","Movistar Plus+ Ficción Total , SkyShowtime",https://www.themoviedb.org/movie/1035259-the-naked-gun/watch?locale=ES
aimee y jaguar,Aimée y Jaguar,LGTB,1999,125,"Drama, Historia, Romance",6.7,Max Färberböck,de,Germany,"En el Berlín de la II Guerra Mundial, Lilly, esposa de un oficial nazi, ama de casa y madre de cuatro hijos, lleva una vida convencional. Felice es judía y trabaja para un periódico nazi bajo un nombre falso, además de suministrar información a la resistencia. Cuando se conocen inician una historia de amor apasionada. Se escriben a diario cartas y poemas con los nombres ficticios de Aimèe y Jaguar. Cuando Lilly llega a saber que Felice es judía, rompe con su vida y emprende una serie de acciones: se divorcia de su marido nazi y hace que Felice se traslade a su apartamento. Pero, un día, las SS están esperándolas en el apartamento de Lilly...",,
"Alien, el octavo pasajero","Alien, el octavo pasajero",10,1979,117,"Terror, Ciencia ficción",8.2,Ridley Scott,en,"United States of America, United Kingdom","De regreso a la Tierra, la nave de carga Nostromo interrumpe su viaje y despierta a sus siete tripulantes. El ordenador central, MADRE, ha detectado la misteriosa transmisión de una forma de vida desconocida, procedente de un planeta cercano aparentemente deshabitado. La nave se dirige entonces al extraño planeta para investigar el origen de la comunicación.",Disney Plus,https://www.themoviedb.org/movie/348-alien/watch?locale=ES
All cheerleaders die,All Cheerleaders Die - Todas las Cheerleaders Muertas,LGTB,2013,90,"Terror, Suspense, Comedia",5.193,Lucky McKee,en,United States of America,"Mäddy Killian es una joven rebelde de 17 años del instituto Blackfoot con la misión de hacer caer al capitán del equipo de futbol. Se alistará a un grupo de cheerleaders para conseguir su propósito, pero una serie de trágicos acontecimientos harán que las chicas se vean empujadas a una batalla sobrenatural que culminará en una noche llena de mutilaciones que nunca olvidarán.",,
All is lost,Cuando todo está perdido,,2013,106,"Acción, Aventura, Drama",6.647,J.C. Chandor,en,United States of America,"En el transcurso de un viaje en solitario a través del Océano Índico, un hombre descubre al despertar que el casco de su velero de 12 metros se ha agrietado tras una colisión con un contenedor que flotaba a la deriva. A pesar de las reparaciones, su intuición de marinero y una fuerza física que desafía su edad, a duras penas logra sobrevivir a la tormenta. Pero el sol implacable, la amenaza de los tiburones y el agotamiento de sus escasas reservas obligan a este marinero sin rumbo a mirar a la muerte a los ojos.",Tivify,https://www.themoviedb.org/movie/152747-all-is-lost/watch?locale=ES
Amadeus,Amadeus,28,1984,160,"Drama, Historia, Música",8.023,Miloš Forman,en,United States of America,"Antonio Salieri es el músico más destacado de la corte del Emperador José II de Austria. Entregado completamente a la música, le promete a Dios humildad y castidad si, a cambio, conserva sus extraordinarias dotes musicales. Pero, después de la llegada a la corte de un joven llamado Wolfang Amadeus Mozart, Salieri queda relegado a un segundo plano. Irritado por la pérdida de protagonismo, hará todo lo posible para arruinar la carrera del joven músico. Mientras tanto, Mozart, ajeno a las maquinaciones de Salieri, sorprende a todos con su genialidad como músico, pero también con sus excentricidades.",Filmin,https://www.themoviedb.org/movie/279-amadeus/watch?locale=ES
Amenaza en las sombras,Amenaza en las sombras,,2019,95,"Drama, Suspense, Película de TV",5.9,Michael Feifer,en,United States of America,"Después de una experiencia cercana a la muerte cuando un atacante irrumpe en su casa, Amanda no puede sacudirse la sensación de que todavía está en peligro. Entra el guapo y severo detective James Dawson para salvar el día y vigilar especialmente a Amanda. Tomada por su generosidad y compromiso, Amanda comienza a sentirse más segura, sin darse cuenta de que está dejando que la amenaza real se acerque más que nunca.",,
American graffiti,American Graffiti,100,1973,112,"Comedia, Drama",7.0,George Lucas,en,United States of America,"Es la última noche del verano de 1962, y los jóvenes de Modesto, California, quieren divertirse antes de que lleguen sus resonsabilidades como adultos. Así, todos los adolescentes del pueblo salen esa noche para beber, ligar, pasearse con el coche, ir a la bolera o bailar un rato...",,https://www.themoviedb.org/movie/838-american-graffiti/watch?locale=ES
Amigas para siempre,Crossroads: hasta el final,,2002,93,"Drama, Romance, Comedia",5.2,Tamra Davis,en,United States of America,"La historia de tres amigas de la infancia, Lucy, Kit y Mimi, quienes después de ocho años deciden redescubrir su amistad y realizan un viaje con el apuesto y misterioso amigo de Mimi, Ben. Su aventura será una lección que cambiará sus vidas para siempre.","Netflix Standard with Ads, Netflix",https://www.themoviedb.org/movie/17130-crossroads/watch?locale=ES
Ammonite,Ammonite,LGTB,2020,117,"Romance, Drama",6.91,Francis Lee,en,United Kingdom,"Narra la historia de amor en la Inglaterra de 1840 entre la paleontóloga Mary Anning y Charlotte Murchinson, una mujer casada. En la conservadora sociedad británica del siglo XIX, la aclamada pero desconocida buscadora de fósiles Mary Anning trabaja sola en el sur del país. Cuando toda su fama ya ha pasado, se dedica a vender fósiles a los turistas para salir adelante, hasta que un visitante rico quiere que Mary cuide a su mujer. La relación entre ambas se irá desarrollando y tomará un camino inesperado.",,https://www.themoviedb.org/movie/568467-ammonite/watch?locale=ES
Amor a media noche,Amor a media noche,,1953,95,"Comedia, Música",4.2,Alexander Hall,en,United States of America,"Un celoso compositor pide el divorcio de su esposa al sospechar que ella está siéndole infiel con otro hombre cuando en realidad se trata de un equívoco. Pero ambos siguen enamorados y, aunque ninguno se niega a dar su brazo a torcer, comienzan un juego de celos buscando nuevas parejas.",,
Amor bajo el espino blanco,Amor bajo el espino blanco,mamá,2010,113,"Drama, Romance",7.772,Zhang Yimou,zh,China,"Adaptación de la novela de Aimi Zhu basada en el guión del también director Yin Lichuan. El film, al igual que la novela, se centra en el inocente pero represivo romance entre una chica que vive en un cerrado entorno político-familiar y un joven campesino.",,
Amores perros,Amores perros,,2000,154,"Drama, Suspense",7.6,Alejandro G. Iñárritu,es,Mexico,"Ciudad de México: un fatal accidente automovilístico afecta trágicamente a tres personas. Octavio, un joven adolescente, decide fugarse con Susana, la esposa de su hermano; el Cofí, su perro, se convierte en el medio para conseguir el dinero que necesitan para poder escapar juntos. Al mismo tiempo, Daniel, un hombre de 42 años, deja a su esposa y a sus hijos para irse a vivir con Valeria, una hermosa modelo. El mismo día en que ambos festejan su nueva vida, el destino hace que Valeria sea víctima del trágico accidente.",,https://www.themoviedb.org/movie/55-amores-perros/watch?locale=ES
An education,An Education,,2009,110,"Drama, Romance",6.943,Lone Scherfig,en,United Kingdom,"Jenny, una atractiva y brillante estudiante de dieciséis años que vive en un tranquilo barrio londinense, sólo piensa en estudiar para poder ir a Oxford. Pero un día conoce a Brit, un tipo seductor de treinta y cinco años, que la corteja con cenas elegantes, clubs y viajes con sus divertidos amigos Danny y Helen. Así las cosas, las convicciones de Jenny se tambalean y se verá obligada a elegir entre seguir con Brit y su ajetreada vida o bien ir a la universidad.","Movistar Plus+ Ficción Total , Movistar Plus+",https://www.themoviedb.org/movie/24684-an-education/watch?locale=ES
Animal kingdom,El reino animal,,2023,127,"Aventura, Drama, Ciencia ficción",7.0,Thomas Cailley,fr,"Belgium, France","En un mundo azotado por una ola de mutaciones que transforman gradualmente a algunos humanos en animales, François hace todo lo posible por salvar a su esposa, afectada por esta misteriosa enfermedad. Mientras la sociedad se ve abocada a un nuevo orden, iniciará junto a Émile, su hijo de 16 años, una búsqueda que los cambiará para siempre.","Amazon Prime Video, Amazon Prime Video with Ads",https://www.themoviedb.org/movie/943134-le-regne-animal/watch?locale=ES
Anomalisa,Anomalisa,,2015,91,"Animación, Drama, Romance, Comedia",7.093,Duke Johnson,en,United States of America,"La película tiene por protagonista a un motivador profesional que, cuanto más ayuda a la gente, más monótona y anodina es su vida; todo el mundo le parece y le suena igual. Hasta que la voz de una chica le suena diferente y está dispuesto abandonarlo todo y a todos por alcanzar la felicidad con ella.",,https://www.themoviedb.org/movie/291270-anomalisa/watch?locale=ES
Another earth,Otra Tierra,,2011,92,"Drama, Ciencia ficción",6.724,Mike Cahill,en,United States of America,"Rhoda Williams, una brillante joven que acaba de ser aceptada en un programa de astrofísica del MIT, aspira a explorar el universo. John Burroughs, un compositor que acaba de alcanzar la cima de su carrera, está a punto de ser padre por segunda vez. Rhoda y John no se conocen, pero la víspera del descubrimiento de un Planeta Tierra duplicado tiene lugar una horrible tragedia que entrelaza y altera de modo irreversible sus vidas.",Disney Plus,https://www.themoviedb.org/movie/55420-another-earth/watch?locale=ES
Arde mississippi,Arde Mississippi,,1988,128,"Drama, Crimen, Misterio, Suspense",7.7,Alan Parker,en,United States of America,"En 1964, en un pueblo sureño, donde el racismo está profundamente arraigado y el Ku Klux Klan sigue celebrando sus ritos y reuniones, tres activistas defensores de los derechos humanos desaparecen sin dejar rastro. Dos agentes del FBI, de caracteres muy diferentes, se harán cargo de la investigación. Allí chocarán con un comisario racista.","Amazon Prime Video, Amazon Prime Video with Ads, Filmin",https://www.themoviedb.org/movie/1632-mississippi-burning/watch?locale=ES
Are you the one,非诚勿扰2,reality,2010,123,"Comedia, Romance, Fantasía",6.0,Feng Xiaogang,zh,China,,,
Arlington road,"Arlington Road, temerás a tu vecino",plot twist,1999,117,"Crimen, Drama, Suspense, Misterio",7.035,Mark Pellington,en,United States of America,"Atormentados por la muerte de su esposa, Michael y su hijo Grant entablan una gran amistad con sus nuevos vecinos, los Hunts. Pero, a medida que las dos familias se encuentran más unidas, Michael empieza a sospechar que sus vecinos no son quienes dicen ser, que algo tienen que esconder, e incluso llegará a pensar que ellos tienen algo que ver con la muerte de su esposa...","Amazon Prime Video, Amazon Prime Video with Ads",https://www.themoviedb.org/movie/1073-arlington-road/watch?locale=ES
Arrugas,Arrugas,,2011,80,"Animación, Drama, Comedia",7.596,Ignacio Ferreras,es,Spain,"ARRUGAS es un largometraje de animación 2D para un público adulto basado en el aclamado cómic del mismo título de Paco Roca (Premio Nacional de Cómic 2008). Arrugas narra la amistad entre Emilio y Miguel, dos ancianos recluidos en un geriátrico. Emilio, que acaba de llegar a la residencia en un estado inicial de Alzheimer será ayudado por Miguel y otros compañeros para no acabar en la planta superior de la residencia, el temido piso de los asistidos que es como llaman allí a los desahuciados. Su alocado plan tiñe de comedia y ternura el tedioso día a día de la residencia porque aunque para muchos sus vidas habían acabado, ellos acababan de empezar una nueva.",,https://www.themoviedb.org/movie/85444-arrugas/watch?locale=ES
As five,映画 プリキュアオールスターズNewStage2 こころのともだち,LGTB,2013,70,"Animación, Acción, Fantasía, Comedia, Aventura, Familia",6.042,Kouji Ogawa,ja,Japan,,,
As the Gods Will,As the Gods Will,como el calamar,2014,117,"Suspense, Terror, Comedia",7.128,Takashi Miike,ja,Japan,"Shun Takahata  es un estudiante corriente que lleva una vida aburrida. Su amigo de toda la vida es Ichika Akimoto . Un día la cabeza de un maestro explota en plena clase. Shun Takahata y sus compañeros se ven obligados a jugar un macabro juego de la muerte sin saber cómo, por qué o quién les ha metido en ese lio.",,
Asesinato en el orient express,Asesinato en el Orient Express,plot twist,2017,114,"Misterio, Drama, Crimen",6.707,Kenneth Branagh,en,United States of America,"Durante un viaje en el legendario tren Orient Express, el detective belga Hercules Poirot investiga un asesinato cometido en el trayecto, y a resultas del cual todos los pasajeros del tren son sospechosos del mismo.",Disney Plus,https://www.themoviedb.org/movie/392044-murder-on-the-orient-express/watch?locale=ES
Aterriza como puedas,Aterriza como puedas,,1980,88,Comedia,7.3,Jim Abrahams,en,United States of America,"El vuelo 209 de la Trans American sale de Los Ángeles con destino a Chicago. Entre el pasaje se encuentran una serie de curiosos personajes. Entre ellos, un ex-piloto de combate que, en pleno vuelo, se verá obligado a hacerse con el mando del avión comercial, tras quedar los pilotos indispuestos por una comida en mal estado.",,https://www.themoviedb.org/movie/813-airplane/watch?locale=ES
Atonement,"Expiación, más allá de la pasión",Plano secuencia,2007,123,"Drama, Romance",7.634,Joe Wright,en,"France, United Kingdom, United States of America","En el verano de 1935, Briony Tallis (Saoirse Ronan), una precoz escritora de 13 años, cambia irremediablemente el curso de varias vidas cuando acusa al amante de su hermana Cecilia (Keira Knightley), el joven Robbie Turner (James McAvoy), de haber cometido un crimen. Los productores y el realizador de ""Orgullo y prejuicio"" vuelven a unirse en este drama.","Amazon Prime Video, Amazon Prime Video with Ads",https://www.themoviedb.org/movie/4347-atonement/watch?locale=ES
Atracción fatal,Escuela de jóvenes asesinos,,1989,105,"Comedia, Crimen",7.267,Michael Lehmann,en,United States of America,"Un grupo de cuatro estudiantes, consideradas como las chicas más populares de su escuela secundaria, cometen todo tipo de crueldades con sus compañeras y compañeros. Una de estas chicas, Verónica Sawyer (Winona Ryder), empieza a darse cuenta de que lo que hacen no es bueno, pero le resulta difícil salir del grupo. Aliada con un nuevo chico que ha llegado a la escuela, logran matar a tres alumnos molestos, aunque en todos los casos aparecen como suicidas. Pronto, Verónica comprobará que su amigo es un psicópata.",Filmin,https://www.themoviedb.org/movie/2640-heathers/watch?locale=ES
Austin powers,Austin Powers: Misterioso agente internacional,,1997,95,"Comedia, Crimen",6.598,Jay Roach,en,"Germany, United States of America","Fotógrafo por el día y superagente británico por la noche, Austin Powers es el espía más irreverente de los años 60. ¿Podrá detener al megalómano Doctor Villano antes de que se congele a sí mismo para revivir en los 90? Con la ayuda de su atractiva compinche Vanessa Kensington, se supone que sí.",,
Bad genius,Bad Genius,,2017,130,"Drama, Crimen, Suspense, Comedia",7.865,Nattawut Poonpiriya,th,Thailand,"Bienvenido al negocio de chuletas para exámenes dirigido por Lynn, una estudiante brillante que encuentra la idea de negocio después de ayudar a Grace y Pat. Grace es una destacada activista escolar que no puede obtener las calificaciones que necesita. Pat es un chico rico y sucio que cree que el dinero puede comprar cualquier cosa. El negocio de Lynn se dispara y se inunda de dinero cuando decenas de estudiantes ofrecen su dinero a cambio de respuestas al examen.",Filmin,https://www.themoviedb.org/movie/455714/watch?locale=ES
Bailando con lobos,Bailando con lobos,17,1990,180,"Aventura, Drama, Western",7.843,Kevin Costner,en,"United Kingdom, United States of America","En torno a 1860, en vísperas de la Guerra de Secesión y a punto de terminar el periodo de colonización del Oeste (1785-1890), el teniente John J. Dunbar se dirige a un lejano puesto fronterizo que ha sido abandonado por los soldados. Su soledad lo impulsa a entrar en contacto con los indios sioux y, gracias a ello, conoce a 'En pie con el puño en alto', una mujer blanca que fue adoptada por la tribu cuando era niña. Poco a poco, entre Dunbar y los sioux se establece una relación de respeto y admiración mutuos.",,
