Movie Spanish,Movie Name real,mi_info,Year,Runtime,Genre,Rating,Director,Language,Country,sinopsis,plataformas,links_plataformas
La reina de áfrica,La reina de África,73,1952,105,"Romance, Aventura, Drama",7.4,John Huston,en,"United Kingdom, United States of America","Durante la Primera Guerra Mundial, un capitán de barco con tendencia a la bebida y una estirada misionera huyen de las tropas alemanas en una ruinosa embarcación y se ven obligados a remontar un peligroso río. Son, a primera vista, dos seres antagónicos, incompatibles, pero la convivencia y, sobre todo, las penalidades que tendrán que afrontar juntos para sobrevivir harán cambiar radicalmente su relación.",,
La reina de katwe,La reina de Katwe,anais,2016,124,Drama,7.232,Mira Nair,en,United States of America,"Protagonizada por David Oyelowo, Lupita Nyong’o y Madina Nalwanga, la película cuenta la historia real de una jovencita vendedora de maíz en las calles de la Uganda rural quien ve su mundo cambiar rápidamente al conocer sobre el juego de ajedrez y, con el apoyo de su comunidad y su familia, obtiene la confianza y determinación necesarias para seguir su sueño de convertirse en una campeona mundial de ajedrez.",Disney Plus,https://www.themoviedb.org/movie/317557-queen-of-katwe/watch?locale=ES
la residencia,Astérix y la residencia de los dioses,,2014,82,"Animación, Comedia, Aventura, Familia",6.789,Louis Clichy,fr,"Belgium, France","Estamos en el año 50 A.C. Toda la Galia está ocupada por los romanos… ¿Toda? ¡No! Una aldea poblada por irreductibles galos resiste todavía y detienen siempre al invasor. Exasperado por la situación, Julio César decide cambiar de táctica: como sus ejércitos han sido incapaces de imponerse por la fuerza, será la misma civilización romana la que se encargará de seducir a los bárbaros galos. Para ello, ordenará construir al lado de la aldea una lujosa residencia para romanos: “la residencia de los Dioses”. ¿Podrán nuestros amigos galos resistirse a la tentación del dinero y el confort romano? ¿La aldea se convertirá en una simple atracción turística? Astérix y Obélix tendrán que esforzarse para frustrar los planes del César.",,https://www.themoviedb.org/movie/170522-asterix-le-domaine-des-dieux/watch?locale=ES
La teniente o’neil,La teniente O'Neil,before30  (1997),1997,125,"Acción, Drama, Bélica",6.5,Ridley Scott,en,"United Kingdom, United States of America","Las presiones de una senadora del Congreso de los EE.UU. convierten a la teniente Jordan O ́Neil en la primera mujer de una unidad de élite del ejército estadounidense. En el fondo, nadie espera que supere un régimen de entrenamiento severísimo que el sesenta por ciento de los reclutas masculinos no consiguen terminar. Sin embargo O ́Neil está dispuesta a demostrar que todo el mundo se equivoca.",,https://www.themoviedb.org/movie/4421-g-i-jane/watch?locale=ES
La tribu,Emmanuelle blanca en la tribu del placer,toti,1975,90,,5.3,Osvaldo Civirani,it,,"Un ingeniero italiano viaja a Santo Domingo para inspeccionar los trabajos de construcción de una represa, dado que su predecesor ha desaparecido sin dejar rastro. En cierto momento, él y su esposa Laura se ven involucrados en los misteriosos ritos vudú que se practican en la isla y que están dirigidos por Balaga, un hechicero opuesto a la construcción de la obra. Hay dos versiones de la película: una normal (esta ficha) y otra con escenas de sexo explícito.",,
La última bandera,La última bandera,toti,2017,124,"Drama, Comedia",6.8,Richard Linklater,en,United States of America,"Tres veteranos de la guerra de Vietnam -Doc (Steve Carell), Sal (Bryan Cranston) y Mueller (Laurence Fishburne)- se reúnen en el año 2003 para enterrar a Larry Jr., el hijo de Doc, que ha muerto en combate en su primer año en la guerra de Iraq.","Amazon Prime Video, Tivify, Amazon Prime Video with Ads",https://www.themoviedb.org/movie/419709-last-flag-flying/watch?locale=ES
La última lección,La última lección,,2018,100,"Suspense, Drama, Misterio",6.0,Sébastien Marnier,fr,France,"Pierre Hoffman se incorpora a una prestigiosa escuela como profesor sustituto y pronto nota, entre algunos de sus alumnos, una hostilidad injustificada y una chispa de violencia en sus ojos. ¿Se debe a la tragedia indescriptible que acaban de vivir? ¿Es porque parecen ser niños extraordinariamente dotados? ¿Es porque han perdido toda esperanza en el futuro? De la curiosidad a la obsesión, Pierre intentará desvelar su secreto.","Amazon Prime Video, Movistar Plus+, Amazon Prime Video with Ads, Filmin, Movistar Plus+ Ficción Total ",https://www.themoviedb.org/movie/475928-l-heure-de-la-sortie/watch?locale=ES
Laberinto de pasiones,Laberinto de pasiones,Pedro Almodóvar,1982,94,"Comedia, Drama, Romance",6.068,Pedro Almodóvar,es,Spain,"Madrid, años 80. Narra la historia de amor entre una joven ninfómana y el hijo de un jeque árabe. Mientras que ella forma parte de un violento grupo musical, a él lo que más le interesa son los cosméticos y los hombres. Música, violencia, persecuciones, pasión, sexo.",,
Ladrón de bicicletas,Ladrón de bicicletas,79,1948,88,Drama,8.171,Vittorio De Sica,it,Italy,"En la Roma de la posguerra, un obrero sin empleo consigue un sencillo trabajo pegando carteles a condición de que posea una bicicleta. Obra maestra del neorrealismo italiano que forma junto con ""Umberto D."" y ""Miracolo a Milano"" la famosa trilogía de De Sica.","Movistar Plus+ Ficción Total , FlixOlé, Movistar Plus+, FlixOlé Amazon Channel",https://www.themoviedb.org/movie/5156-ladri-di-biciclette/watch?locale=ES
Lady from shanghai,La dama de Shanghai,plot twist,1947,87,"Misterio, Crimen, Suspense, Drama",7.4,Orson Welles,en,United States of America,"Michael O'Hara (Orson Welles), un marinero irlandés, entra a trabajar en un yate a las órdenes de un inválido casado con una mujer fatal (Rita Hayworth) y queda atrapado en una maraña de intrigas y asesinatos.","Movistar Plus+ Ficción Total , Movistar Plus+",https://www.themoviedb.org/movie/3766-the-lady-from-shanghai/watch?locale=ES
Larga vida y prosperidad,Larga vida y prosperidad,LGTB,2018,93,"Comedia, Drama",6.767,Ben Lewin,en,United States of America,"El mundo es un lugar confuso para Wendy (Dakota Fanning), una joven con autismo, brillante e independiente. Wendy desea dejar su hogar de acogida, donde es supervisada por su cuidadora principal, Scottie (Toni Collette), y vivir su hermana Audrey (Alice Eve) y su nuevo bebé.","Acontra Plus Amazon Channel, Acontra Plus, Filmin",https://www.themoviedb.org/movie/338768-please-stand-by/watch?locale=ES
Las amigas de ágata,Las amigas de Agata,,2016,70,Drama,5.4,Laia Alabart,ca,Spain,"Retrato de un grupo de chicas de 20 años realizado a través de la mirada de Ágata, una chica que, de manera involuntaria, empieza a sentir un cambio en la visión que tiene de sus amigas de infancia Carla, Ari y Mar. (FILMAFFINITy)",Filmin,https://www.themoviedb.org/movie/338553-les-amigues-de-l-agata/watch?locale=ES
Las aventuras de jeremiah johnson,Las aventuras de Jeremiah Johnson,,1972,109,Western,7.3,Sydney Pollack,en,United States of America,"Después de desertar de la guerra entre Estados Unidos y Méjico y hastiado de la civilización, el soldado Jeremías Johnson, decide dejarlo todo y establecerse en las heladas montañas. Allí, con la ayuda de un viejo trampero, tendrá que luchar para sobrevivir. Descubrirá la violencia de los indios que habitan esas tierras y tendrá que defender a su familia. Finalmente su ira caerá sobre la tribu de los Crow.",Tivify,https://www.themoviedb.org/movie/11943-jeremiah-johnson/watch?locale=ES
Las Five,El imperio contraataca,LGTB,1980,124,"Aventura, Acción, Ciencia ficción",8.4,Irvin Kershner,en,United States of America,"Tras un ataque sorpresa de las tropas imperiales a las bases camufladas de la alianza rebelde, Luke Skywalker, en compañía de R2D2, parte hacia el planeta Dagobah en busca de Yoda, el último maestro Jedi, para que le enseñe los secretos de la Fuerza. Mientras, Han Solo, la princesa Leia, Chewbacca, y C3PO esquivan a las fuerzas imperiales y piden refugio al antiguo propietario del Halcón Milenario, Lando Calrissian, en la ciudad minera de Bespin, donde les prepara una trampa urdida por Darth Vader.",Disney Plus,https://www.themoviedb.org/movie/1891-the-empire-strikes-back/watch?locale=ES
Las ocho montañas,Las ocho montañas,andrea compton,2022,147,Drama,7.6,Felix van Groeningen,it,"Belgium, France, Italy, United Kingdom","Pietro es un chico de ciudad, Bruno es el último niño de una localidad de montaña olvidada. Con el paso de los años, Bruno se mantiene fiel a su montaña, mientras que Pietro viene y va. Sus experiencias le harán enfrentarse al amor y a la pérdida, recordándoles sus orígenes y abriendo paso al destino.",Filmin,https://www.themoviedb.org/movie/803700-le-otto-montagne/watch?locale=ES
Las uvas de la ira,Las uvas de la ira,89,1940,129,Drama,7.8,John Ford,en,United States of America,"Tom Joad regresa a su hogar tras cumplir condena en prisión, pero la ilusión de volver a ver a los suyos se transforma en frustración al ver cómo los expulsan de sus tierras. Para escapar al hambre y a la pobreza, la familia no tiene más remedio que emprender un larguísimo viaje lleno de penalidades con la esperanza de encontrar una oportunidad en California, la tierra prometida.",,https://www.themoviedb.org/movie/596-the-grapes-of-wrath/watch?locale=ES
Le week-end,Esencia de mujer,,1992,157,Drama,7.787,Martin Brest,en,United States of America,"Frank Slade es un malhumorado Coronel en la reserva del ejército norteamericano, retirado pues sufre de ceguera. Durante el fin de semana de Acción de Gracias el joven estudiante Charlie Simms, contratado por la familia de Slade, se queda en su casa para servirle de lazarillo y procurar que no beba mucho. Pero Frank tiene otros planes: irse a la gran ciudad de Nueva York... Remake de la película italiana de 1974 ""Profumo di donna"" (Perfume de mujer).",,https://www.themoviedb.org/movie/9475-scent-of-a-woman/watch?locale=ES
Leon el profesional,El profesional (Léon),clasicas que no vi,1994,110,"Crimen, Drama, Acción",8.3,Luc Besson,fr,France,"Stan es un corrupto agente de la DEA cuya codicia le lleva a cometer asesinatos en las calles de Nueva York. El mortal juego del gato y el ratón empieza cuando se cruza en su camino un solitario hombre, llamado León. León es asesino a sueldo, un personaje indestructible e indocumentado, que sólo bebe leche y se ocupa de sus plantas. En medio se encuentra una huerfanita de 12 años, que no puede olvidar al hombre que asesinó a su familia.",,
Leonera,Leonera,carcel,2008,113,Drama,6.239,Pablo Trapero,es,"Argentina, Brazil, South Korea, Spain","Julia (Martina Gusman) es una joven acusada del asesinato de su novio. Aunque las circunstancias del crimen no están claras, acaba ingresando en prisión. Abatida y embarazada deberá adaptarse a su nueva vida en la cárcel, donde nacerá su hijo Tomás.","Netflix Standard with Ads, Netflix",https://www.themoviedb.org/movie/8900-leonera/watch?locale=ES
Leviatán,Leviathan (El Demonio Del Abismo),,1989,97,"Aventura, Terror, Suspense, Ciencia ficción",5.986,George P. Cosmatos,en,"Italy, United States of America","Bajo las aguas hay una base minera submarina que habitan 8 personas dedicadas a la búsqueda de materiales para extraerlos a la superficie. En una de sus misiones bajo el mar descubren un submarino soviético hundido en el que todo demuestra se estaban realizando experimentos genéticos, como resultado de lo cual habría surgido una monstruosa criatura prácticamente indestructible. Pero los problemas no acaban aquí puesto que aquellos miembros de la base submarina expuestos directamente a los resultados erróneos de este experimento comienzan a sufrir directamente en sus carnes un cambio que los convertiría en medio peces. La lucha por escapar del lugar y destruir a ese monstruo será lo que marque su inmediato destino, porque sino serán devorados por éste.",Filmin,https://www.themoviedb.org/movie/14372-leviathan/watch?locale=ES
Life after beth,Amor zombie,,2014,90,"Romance, Comedia, Terror",5.52,Jeff Baena,en,United States of America,"Cuenta la historia de amor entre un vivo y una no-muerta, Beth, quién tras un trágico accidente volverá a la vida para proseguir con la relación con su novio, si bien evidentemente no le será nada fácil.",,
Light Light Light,Mulán: Enciende el Fuego,LGTB,2026,98,Drama,0.0,Kam Ka-Wai,zh,China,"Exsoldado Mulan regresa a su aldea y descubre que sus padres han sido asesinados y su hermano desaparecido. Al investigar, destapa una red de falsificación de moneda y corrupción oficial, pero es incriminada por el magistrado Ji Shixun, quien en realidad es el verdadero cerebro del complot. Tras sobrevivir a la persecución y perder a su hermano, Mulan regresa al combate, lidera una rebelión popular, derrota a los responsables y abandona su hogar para iniciar un nuevo viaje.",,
Linterieur,Al interior,,2007,83,Terror,6.7,Alexandre Bustillo,fr,France,"Una mujer embarazada y viuda (Alysson Paradis), cuyo novio ha fallecido recientemente, pasa la noche de navidad a solas, completamente afligida por la pérdida del padre de su bebé, cuando una extraña (Béatrice Dalle) se presenta en su casa...","AMC Plus Apple TV Channel , Amazon Prime Video, Amazon Prime Video with Ads, AMC+ Amazon Channel, Planet Horror Amazon Channel",https://www.themoviedb.org/movie/13312-a-l-interieur/watch?locale=ES
Linterna roja,La linterna roja,mamá,1991,125,Drama,7.919,Zhang Yimou,zh,"China, Hong Kong, Taiwan","La película nos muestra la vida de las cuatro esposas de un hombre rico que viven en una gran casa. El hombre es el dueño y señor y las mujeres son de su propiedad y cada día elige a una de ellas para pasar la noche, mediante la colocación de una gran linterna roja en la puerta de la habitación de la mujer escogida. Este rito da lugar al título y provoca las mejores situaciones de la película, al reflejar la tensión y la rivalidad producida en las mujeres cada atardecer, cuando esperan en las puertas de sus habitaciones ver en cúal de ellas lucirá esa noche la lámpara. Esas cuatro paredes, este patio interior, típico de las casas chinas, se convierten en un microuniverso -que no quiere saber que fuera hay otras alternativas- en el que hasta el más pequeño detalle adquiere la mayor relevancia.","Acontra Plus Amazon Channel, Acontra Plus",https://www.themoviedb.org/movie/10404/watch?locale=ES
lo que el pulpo me enseñó,Lo que el pulpo me enseñó,,2020,85,Documental,7.9,Pippa Ehrlich,en,"South Africa, United Kingdom","Después de años de nadar todos los días en el océano helado en la punta de África, Craig Foster conoce a un maestro poco probable: un pulpo joven que muestra una curiosidad notable. Al visitar su guarida y seguir sus movimientos durante meses y meses, finalmente se gana la confianza del animal y desarrollan un vínculo nunca antes visto entre humanos y animales salvajes.","Netflix Standard with Ads, Netflix",https://www.themoviedb.org/movie/682110-my-octopus-teacher/watch?locale=ES
Lo que el viento se llevó,Lo que el viento se llevó,13,1939,238,"Drama, Bélica, Romance",7.9,Victor Fleming,en,United States of America,"Georgia, 1861. En la elegante mansión sureña de Tara, vive Scarlett O'Hara, la joven más bella, caprichosa y egoísta de la región. Ella suspira por el amor de Ashley, pero él está prometido con su prima, la dulce y bondadosa Melanie. Corren todavía tiempos felices en Tara, pero por poco tiempo, porque la Guerra de Secesión (1861-1865) está a punto de estallar. En la última fiesta, celebrada antes del comienzo de las hostilidades entre el norte y el sur, Scarlett conoce al simpático, cínico y apuesto Rhett Butler, un vividor arrogante y aventurero, que sólo piensa en sí mismo y que no tiene ninguna intención de participar en el conflicto. Lo que él desea es hacerse rico y conquistar el corazón de la hermosa Scarlett.","Movistar Plus+, Filmin, Movistar Plus+ Ficción Total , HBO Max, HBO Max Amazon Channel",https://www.themoviedb.org/movie/770-gone-with-the-wind/watch?locale=ES
Locke,Blindado,,2025,95,"Terror, Suspense",6.191,David Yarovesky,en,"United States of America, Canada, Czech Republic",Un ladrón irrumpe en un todoterreno de lujo y se da cuenta de que ha tropezado con una trampa compleja y mortal tendida por una misteriosa figura.,"Movistar Plus+ Ficción Total , Movistar Plus+",https://www.themoviedb.org/movie/1083968-locked/watch?locale=ES
Loreak,Loreak,,2014,99,Drama,6.9,Jose Mari Goenaga,eu,Spain,"La vida de Ane da un giro cuando semanalmente comienza a recibir de forma anónima un ramo de flores en su casa. Por su parte las vidas de Lourdes y Tere también se ven afectadas por unas misteriosas flores. Un desconocido deposita cada semana un ramo en memoria de alguien que fue importante en sus vidas. Esta es la historia de tres mujeres, tres vidas alteradas por la mera presencia de unas flores. Flores que harán brotar en ellas sentimientos que parecían olvidados… Pero al fin y al cabo, no son más que flores.",rtve,https://www.themoviedb.org/movie/260313-loreak/watch?locale=ES
Los amigos de peter,Winnie the Pooh: Los amigos inseparables,mamá,2003,55,"Animación, Familia",6.6,,en,,"Recopilatorio con los siguientes episodios de Las nuevas aventuras de Winnie the Pooh: ""Un animal muy, muy grande"", ""Ningún conejo es una fortaleza"", ""Rayas"" y ""Las zapatillas de Tigger"".",,
Los chicos del maíz,Los chicos del maíz,,1984,93,"Terror, Suspense",5.739,Fritz Kiersch,en,United States of America,"Una joven pareja que viaja por el medio oeste estadounidense se pierde y llega a una pequeña ciudad en la que todos los adultos han sido asesinados por los niños del lugar, a su vez poseídos por una malévola fuerza surgida de los campos de maíz que alcanzan hasta donde llega la vista.",,
Los exiliados romanticos,Los exiliados románticos,Antía,2015,70,"Drama, Romance",5.2,Jonás Trueba,es,Spain,"Tres amigos emprenden un viaje en busca de amores idílicos y efímeros.Lo que pretenden es experimentar nuevas emociones que les hagan sentirse vivos. Podría ser un intento de quemar las últimas naves de la juventud, pero también podría ser una muestra de la decadencia del género masculino.",,
Los intocables de eliot ness,Los intocables de Eliot Ness,24,1987,119,"Crimen, Historia, Suspense",7.8,Brian De Palma,en,United States of America,"El joven agente del tesoro Elliot Ness llega a Chicago con la determinación de detener a Al Capone. No va a ser tarea fácil, puesto que Capone tiene a la policía en el bolsillo. Ness conoce a Jimmy Malone, un guardia veterano y probablemente el más honrado de todo el cuerpo, al que Ness pide ayuda en su cruzada contra Capone.",,https://www.themoviedb.org/movie/117-the-untouchables/watch?locale=ES
Los mejores años de nuestra vida,Los mejores años de nuestra vida,103,1946,170,"Drama, Romance, Bélica",7.8,William Wyler,en,United States of America,"Tras la Segunda Guerra Mundial (1939-1945), los soldados supervivientes, algunos con taras físicas, regresan a los Estados Unidos. Aunque al principio se les trata como héroes, poco tiempo después comienzan a verse marginados.",Filmin,https://www.themoviedb.org/movie/887-the-best-years-of-our-lives/watch?locale=ES
Los peregrinos,Yaji y Kita: Los peregrinos de medianoche,valentina,2005,124,"Acción, Comedia, Fantasía",6.0,Kankuro Kudo,ja,Japan,"Dos amantes samurai homosexuales se embarcan en una misión hacia Ise Shrine, un viaje que los obliga a enfrentar de todo, desde la drogadicción hasta una batalla con el Rey Artiuro. Basada parcialmente en la novela de Tokkaidochu Hizakurige.",,
Los siete samuráis,Los siete samuráis,71,1954,207,"Acción, Drama",8.449,Akira Kurosawa,ja,Japan,"Una banda de forajidos atemorizan a los habitantes de un pequeño pueblo, saqueándolos periódicamente sin piedad. Para repeler estos ataques, los aldeanos deciden contratar a mercenarios. Finalmente, consiguen los servicios de 7 guerreros, 7 samurais dispuestos a defenderlos a cambio, tan solo, de cobijo y comida.","Acontra Plus Amazon Channel, Acontra Plus, Filmin",https://www.themoviedb.org/movie/346/watch?locale=ES
Lost & Found You,Flunk: Lost & Found You,LGTB,2024,0,,0.0,Ric Forster,en,,,,
Love story,Tamako Love Story,before30  (1970),2014,83,"Romance, Animación, Comedia",7.2,Naoko Yamada,ja,Japan,"Tamako, en su último año de secundaria, solo piensa en el mochi y en continuar con el negocio familiar. Sin embargo, mientras sus amigos se preocupan por el futuro, Mochizou toma una decisión importante, despertando sentimientos en Tamako que nunca había considerado.",,
Luces de la ciudad,Luces de la ciudad,76,1931,87,"Comedia, Drama, Romance",8.3,Charlie Chaplin,en,United States of America,Un pobre vagabundo (Charles Chaplin) pasa mil y un avatares para conseguir dinero y ayudar a una pobre chica ciega (Virginia Cherill) de la que se ha enamorado.,"Acontra Plus Amazon Channel, Acontra Plus",https://www.themoviedb.org/movie/901-city-lights/watch?locale=ES
Macbeth,Macbeth,,2021,105,Drama,6.931,Joel Coen,en,United States of America,"Macbeth, recibe una profecía de un trío de brujas de que algún día se convertirá en rey de Escocia. Consumido por la ambición y empujado a la acción por su esposa, Macbeth asesina a su rey y toma el trono para él.","Apple TV, Apple TV Amazon Channel, Movistar Plus+, Movistar Plus+ Ficción Total ",https://www.themoviedb.org/movie/591538-the-tragedy-of-macbeth/watch?locale=ES
Magical girl,Zettai Junpaku Mahou Shoujo,,2012,6,"Acción, Animación, Fantasía",6.542,Shinsuke Yanagi,ja,Japan,"Kuramoto Erica, Nitta Yui, Suzuhara Misa y Sasaki Kotone no son colegialas promedio. De hecho, están bendecidos con poderes sobrenaturales, que utilizan para defender a la gente común de las criaturas alienígenas.",,
Magnolia,Magnolia,93,1999,188,Drama,7.729,Paul Thomas Anderson,en,United States of America,"La película consta de nueve tramas paralelas que tienen lugar en el Valle de San Fernando, en Los Angeles: un niño prodigio, el presentador de un concurso de televisión, un ex-niño prodigio, un moribundo, su hijo perdido, la mujer y el enfermero del moribundo. Son historias aparentemente independientes, pero que guardan entre sí una extraña relación. Magnolia es el retrato de la vida americana visto a través de una serie de viñetas cómicas y conmovedoras.","Movistar Plus+ Ficción Total , Movistar Plus+, Filmin",https://www.themoviedb.org/movie/334-magnolia/watch?locale=ES
Manchester frente al mar,Manchester frente al mar,,2016,137,Drama,7.554,Kenneth Lonergan,en,United States of America,"Lee Chandler es un fontanero que se ve obligado a regresar a su pequeño pueblo natal tras enterarse de que su hermano ha fallecido. Allí se encuentra con su sobrino de 16 años, del que tendrá que hacerse cargo. De pronto, Lee se verá obligado a enfrentarse a un pasado trágico que le llevó a separarse de su esposa Randi y de la comunidad en la que nació y creció.",,https://www.themoviedb.org/movie/334541-manchester-by-the-sea/watch?locale=ES
Manhattan,Sucedió en Manhattan,75,2002,105,"Comedia, Drama, Romance",6.1,Wayne Wang,en,United States of America,"Moderna adaptación de ""Cenicienta"". Marisa Ventura es una madre soltera de Nueva York que trabaja como empleada de la limpieza en un lujoso hotel de Manhattan. Christopher Marshall, un joven y apuesto político candidato a senador, la confunde con una de las huéspedes del hotel.",,https://www.themoviedb.org/movie/7303-maid-in-manhattan/watch?locale=ES
Manifest,Manifest West,,2022,91,"Suspense, Drama",5.9,Joe Dietsch,en,United States of America,Una historia sobre la mayoría de edad contada a través de los ojos de una niña cuya familia se sale de control después de que deciden vivir fuera de la red.,,
Margarita with a Straw,Margarita with a Straw,LGTB,2015,100,Drama,6.774,Shonali Bose,hi,India,"Laila Kapoor es una talentosa joven de 19 años de edad proveniente de una familia de clase media en Delhi. Nacida con parálisis cerebral, su habla es ininteligible y va en silla de ruedas. Está muy unida a su madre, Shubhangini Damle, quien se esfuerza en que pueda ir a la prestigiosa Universidad de Delhi. Y cuando el corazón de la joven se rompe, su madre la envía a continuar su educación en la Universidad de Nueva York. Allí conoce a la luchadora Khanum, una mujer con discapacidad visual y al despreocupado Jared. Siempre curiosa acerca de la sexualidad, Laila se somete a un viaje más allá de sus sueños más salvajes. Con nuevas verdades sobre si misma, se enfrenta a su madre causando un enorme conflicto que destroza su mundo. Pasando de ser la cuidada a la cuidadora, el vínculo entre madre e hija se pone a prueba al máximo. (FILMAFFINITY)",,
Marshland,La isla mínima,plot twist,2014,105,"Crimen, Misterio, Suspense",7.035,Alberto Rodríguez,es,Spain,"Ambientada en 1980, cuenta la historia de Juan y Pedro, dos policías ideológicamente opuestos que trabajan en el departamento de homicidios de Madrid y que, como sanción, son destinados a un pequeño pueblo en las marismas del Guadalquivir. Allí tratarán de resolver el caso de dos adolescentes, que fueron brutalmente asesinadas durante las fiestas del pueblo.  Los agentes deberán dejar de lado sus diferencias para dar con el peligroso asesino de las chicas, el cual lleva años matando a jóvenes de los alrededores. Una investigación que a los aldeanos no les parece interesar, pues es un pueblo anclado en el pasado y las mujeres están menospreciadas.","Amazon Prime Video, Movistar Plus+, Amazon Prime Video with Ads, HBO Max, HBO Max Amazon Channel, SkyShowtime",https://www.themoviedb.org/movie/236735-la-isla-minima/watch?locale=ES
