Movie Spanish,Movie Name real,mi_info,Year,Runtime,Genre,Rating,Director,Language,Country,sinopsis,plataformas,links_plataformas
Platoon,Platoon,35,1986,120,"Drama, Bélica, Acción",7.75,Oliver Stone,en,"United Kingdom, United States of America","Chris Taylor es un ingenuo joven estadounidense que, a su llegada a Vietnam, descubre que no sólo debe combatir contra los soldados vietnamitas sino también contra el miedo que le atormenta, el cansancio y la rabia que le invade. Mientras sus dos oficiales al mando libran su propia batalla personal, el conflicto, el caos y el odio hacen mella en Taylor, confundiendo su realidad e insensibilizándole ante el valor más preciado del ser humano... la vida.","Amazon Prime Video, Tivify, Amazon Prime Video with Ads, Filmin",https://www.themoviedb.org/movie/792-platoon/watch?locale=ES
Please Speak Continuously and Describe Your Experiences as They Come to You,Please Speak Continuously and Describe Your Experiences as They Come to You,,2019,10,"Ciencia ficción, Terror",7.357,Brandon Cronenberg,en,Canada,,,
poker face,Poker Face,como knives out,2022,94,"Suspense, Crimen",5.569,Russell Crowe,en,United States of America,"El multimillonario jugador de póquer Jake Foley (Russell Crowe) les brinda a sus mejores amigos la oportunidad de ganar más dinero del que jamás hayan soñado, en una noche que nunca olvidarán. Pero para jugar, tendrán que revelar algunos de sus secretos más oscuros, y a medida que avance la noche, descubrirán el motivo real por el que participan...",,https://www.themoviedb.org/movie/842934-poker-face/watch?locale=ES
Polarized,Polarized,LGTB,2025,104,"Romance, Drama",6.286,Shamim Sarif,en,"Canada, United Kingdom",,"OUTtv Amazon Channel, Filmin",https://www.themoviedb.org/movie/987427-polarized/watch?locale=ES
Poltergeist,Poltergeist (Fenómenos extraños),22,1982,114,Terror,7.158,Tobe Hooper,en,United States of America,"Una familia americana de clase media se traslada a vivir e una nueva casa en un aparentemente idílico barrio, pero dentro de la casa comienzan a suceder cosas extrañas, fenómenos paranormales para los que no hay explicación posible.","Movistar Plus+ Ficción Total , Movistar Plus+",https://www.themoviedb.org/movie/609-poltergeist/watch?locale=ES
Pose,Pose,Serie,2026,77,Suspense,6.3,Jamie Adams,en,"United States of America, United Kingdom","Dos parejas llegan a una mansión rural que reservaron juntas sin saberlo, y descubren extraños sucesos durante su estancia.",,
Precious,Precious,,2009,105,Drama,7.323,Lee Daniels,en,United States of America,"Claireece 'Precious' Jones tiene 16 años, es obesa y analfabeta y espera su segundo hijo de su propio padre ausente. Vive en Harlem, el reino de los invisibles, de los sin voz, con su madre, una reclusa cruel que mira la televisión sin cesar y la somete a los más denigrantes abusos. Forzada a abandonar la escuela a causa de su embarazo, Precious acaba en un instituto para casos desesperados. Y allí, en el último escalón de aquellos que ya han bajado todas las escaleras, está la señorita Rain, una maestra joven, combativa y radical a través de la cual Precious tendrá la posibilidad de recuperar su voz y su dignidad descubriendo un nuevo mundo en el que puede al fin expresarse de una manera que nunca antes había imaginado.",,
Predestination,Predestination,,2014,97,"Ciencia ficción, Suspense",7.416,Michael Spierig,en,Australia,"En su último trabajo, un agente del tiempo debe dar caza a un escurridizo criminal. La persecución se convierte en una sorprendente exploración en las distintas épocas del tiempo.",,https://www.themoviedb.org/movie/206487-predestination/watch?locale=ES
Puente a terabithia,Un puente hacia Terabithia,,2007,95,"Aventura, Drama, Familia",7.332,Gábor Csupó,en,United States of America,"Jess Aarons, un chico que se siente extraño tanto en el colegio como en su propia casa, se ha entrenado durante todo el verano para correr una carrera; pero llega al colegio Leslie Burke y le gana. A pesar de ello, pronto se hacen amigos. Leslie, aficionada a contar fantásticas y mágicas historias, le abre a Jess las puertas de un mundo dominado por la imaginación. A Jess le gusta dibujar, pero nunca había compartido esa afición con nadie. Los dos crean el reino secreto de Terabithia, un lugar mágico cuya entrada sólo ellos conocen. Allí reinan, luchan contra el Maestro Oscuro y sus criaturas y trazan planes para vengarse de los compañeros prepotentes del colegio.",Lionsgate+ Amazon Channels,https://www.themoviedb.org/movie/1265-bridge-to-terabithia/watch?locale=ES
Pushing Daisies,Pushing Up Daisies,,1973,85,"Acción, Comedia",8.0,Ivan Nagy,en,,,,
Quiero comerme tu pancreas,Quiero comerme tu páncreas,Anime,2018,109,"Animación, Drama, Romance",8.226,Shinichiro Ushijima,ja,Japan,"Un estudiante descubre el diario de su compañera Sakura, quien padece una enfermedad terminal. Al ser el único fuera de su familia que lo sabe, decide apoyarla y compartir tiempo con ella en sus últimos meses.",,
Radio encubierta,Radio encubierta,before30,2009,129,"Drama, Comedia",7.225,Richard Curtis,en,"United Kingdom, France, Germany","Inglaterra, años 60. Narra la historia de Radio Rock, una emisora pirata. En 1966, la BBC sólo emitía dos horas de rock and roll a la semana. Pero la Radio Rock, que inundaba el país de rock y pop 24 horas al día, consiguió una audiencia de 25 millones de personas, más de la mitad de la población. Cuando Carl es expulsado del colegio, su madre lo manda a pasar una temporada con su padrino Quentin, que es el jefe de esa emisora pirata que emite desde un barco en el mar del Norte. Entre los extravagantes pinchadiscos destaca ""El Conde"", un auténtico ídolo de las ondas. Lo secundan Dave, inteligente y sarcástico, Simon, un chico amable que busca el amor verdadero, el enigmático y apuesto Midnight Mark entre otros.","Amazon Prime Video, Amazon Prime Video with Ads",https://www.themoviedb.org/movie/18947-the-boat-that-rocked/watch?locale=ES
Ratched,"Ratchet & Clank, la película",LGTB,2016,94,"Acción, Aventura, Animación, Familia",5.8,Kevin Munroe,en,"Canada, Hong Kong, United States of America","En el planeta Veldin, Ratchet sueña con convertirse en uno de los héroes de los Galactic Space Rangers liderados por el carismático Qwark. La oportunidad de salir de su tediosa vida en un pequeño garaje de reparación de naves parece llegarle del cielo cuando Qwark convoca una prueba para incorporar nuevos miembros a su equipo. Mientras tanto, el intrigante y maligno villano Drek decide destruir el planeta Tenemule con su nuevo y flamante Desplanetizador. Adaptación al cine del videojuego homónimo.",,
Reality bites,Bocados de realidad,peli para millenials,1994,95,"Drama, Romance, Comedia",6.5,Ben Stiller,en,United States of America,"Lelaina Pierce (Winona Ryder), ayudante de producción en un programa matinal de televisión, sueña con ser directora de cine. Mientras llega su gran oportunidad rueda un vídeo de sus amigos en los que estos hablan de su realidad cotidiana, sus ambiciones y su falta de expectativas. Entre tanto, debe elegir entre dos amores, un yuppie y su leal amigo Troy. Drama generacional de joven y conocido reparto que se promocionó como la película de la ""generación X"".","Movistar Plus+ Ficción Total , SkyShowtime",https://www.themoviedb.org/movie/2788-reality-bites/watch?locale=ES
Renglones torcidos de dios,Los renglones torcidos de Dios,,2022,155,"Drama, Misterio, Suspense",7.311,Oriol Paulo,es,Spain,"Alice Gould, una investigadora privada, simula que padece una enfermedad mental con objeto de ingresar en un hospital psiquiátrico y recabar pruebas del caso en el que trabaja: la muerte de un paciente en circunstancias poco claras.","Netflix Standard with Ads, Netflix",https://www.themoviedb.org/movie/890980-los-renglones-torcidos-de-dios/watch?locale=ES
Revolver,ரிவால்வர் ரீட்டா,guy ritchi,2025,140,"Comedia, Acción, Crimen",6.5,K. Chandru,ta,India,,"Netflix Standard with Ads, Netflix",https://www.themoviedb.org/movie/1074048/watch?locale=ES
Risky business,Risky Business,tom cruise,1983,98,"Romance, Comedia, Drama",6.6,Paul Brickman,en,United States of America,"Joel Goodsen es un joven de 17 años, universitario y responsable. Un chico en el que cualquiera puede confiar. Pero ha sido bueno durante demasiado tiempo. Ahora los padres de Joel se encuentran de viaje, y él está solo a cargo de la casa. Sus padres, confían en él. Aunque quizá no deberían...",,https://www.themoviedb.org/movie/9346-risky-business/watch?locale=ES
Roar,El Gran Rugido,,1981,102,"Aventura, Comedia, Terror, Suspense",5.9,Noel Marshall,en,United States of America,"Hank el zoólogo y sus mejores amigos comparten una hermosa casa junto a un lago africano. Pero nadie viene a visitarlos, porque los amigos de Hank corretean por todas partes y son grandes, peludos y con aspecto hambriento: leones, tigres, leopardos, pumas, jaguares... Su vida placentera se torcerá cuando su familia decide dejar los Estados Unidos y trasladarse a vivir con él.",,
Rocky,रॉकी और रानी की प्रेम कहानी,5,2023,178,"Comedia, Drama, Familia, Romance",6.142,Karan Johar,hi,India,,"Amazon Prime Video, Amazon Prime Video with Ads",https://www.themoviedb.org/movie/848116/watch?locale=ES
Rocky balboa,Creed. La leyenda de Rocky,,2015,133,Drama,7.408,Ryan Coogler,en,United States of America,"Adonis Johnson no llego a conocer a su padre, el campeón del mundo de los pesos pesados Apollo Creed, que falleció antes de que él naciera. Sin embargo, nadie puede negar que lleva el boxeo en la sangre, por lo que pone rumbo a Filadelfia, el lugar en el que se celebró el legendario combate entre su padre y Rocky Balboa. Una vez allí, Adonis busca a Rocky y le pide que sea su entrenador. A pesar de que este insiste en que ya ha dejado ese mundo para siempre, Rocky ve en Adonis la fuerza y determinación que tenía su enconado rival, y que terminó por convertirse en su mejor amigo. Finalmente, acepta entrenarle a pesar de estar librando su propio combate contra un rival más letal que cualquiera a los que se enfrentó en el cuadrilátero.",AMC Channels Amazon Channel,https://www.themoviedb.org/movie/312221-creed/watch?locale=ES
Roma ,Habitación en Roma,2a,2010,109,"Drama, Romance",6.412,Julio Medem,es,"Spain, France","Verano de 2008. Se inspira en el film 'En la cama', del chileno Matías Bize. En un hotel del centro de Roma se conocen una rusa y una española. Al día siguiente Alba volverá a España y Natasha, a Rusia. En la habitación del hotel se respira una atmósfera cargada de erotismo y sensualidad. Entre ellas nace un sentimiento nuevo que ambas aceptan. Durante doce horas, las dos mujeres se confían sus vidas, hablan de sus compromisos y del amor sincero por sus respectivas parejas.",,
Rudy reto a la gloria,"Rudy, reto a la gloria",,1993,116,"Drama, Historia",7.3,David Anspaugh,en,United States of America,"A Daniel E. Ruettiger todo el mundo le decía que era imposible que pudiera triunfar. Su padre, sus profesores, entrenadores y amigos estaban convencidos de que Rudy nunca podría ser admitido en la Universidad de Nôtre Dame y menos aún entrar en el más prestigioso programa de fútbol americano de la nación. Así las cosas, Daniel se va hundiendo cada vez más.","Movistar Plus+ Ficción Total , Movistar Plus+",https://www.themoviedb.org/movie/14534-rudy/watch?locale=ES
Saving face,Guardando las apariencias,LGTB,2004,100,"Comedia, Romance, Drama",7.3,Alice Wu,en,United States of America,"Para Wilhelmina ""Wil"" Pang, neoyorquina de 28 años, la vida es una representación de juegos malabares entre una prometedora carrera como cirujana y sus responsabilidades como hija obediente. Al igual que la línea 7 del metro que la lleva a visitar a su familia china una vez por semana, Wil está permanentemente en tránsito entre dos mundos. Las expectativas de la sociedad de Flushing, Queens, de la que procede, y su propio deseo de alejarse de ella han logrado que Wil esté satisfecha con la vida paralela que ha optado llevar, a pesar de que ello conlleve un involuntario juego de charadas con su madre viuda y el viejo mundo que ésta representa. (FILMAFFINITY)",,https://www.themoviedb.org/movie/19316-saving-face/watch?locale=ES
Say anything,Un gran amor,,1989,100,"Romance, Comedia, Drama",7.01,Cameron Crowe,en,United States of America,"Lloyd Dobler, un eterno optimista, busca conseguir el corazón de Diane Court, una inalcanzable belleza del instituto, además de una intachable estudiante. Todo el mundo se sorprende, incluido Lloyd, cuando ella demuestra que el sentimiento es recíproco. Pero el posesivo padre divorciado de Diane no aprueba esa relación, y hará falta algo más que el poder del amor para que consigan seguir juntos.","Netflix Standard with Ads, Netflix",https://www.themoviedb.org/movie/2028-say-anything/watch?locale=ES
Scrooged,Los fantasmas atacan al jefe,,1988,101,"Fantasía, Comedia, Drama",6.787,Richard Donner,en,United States of America,"La desbordante alegría de las fiestas de Nochebuena va a hacer que Frank Cross sufra unas visiones fantasmagóricas en esta divertida sátira de “Un Cuento de Navidad” de Charles Dickens. Cross, que ha hecho una carrera meteórica desde lo más recóndito del departamento de envíos de una cadena de TV hasta la presidencia, es tacaño, desagradable, ingrato, implacable y con un cruel sentido del humor, cualidades idóneas para un miserable de hoy en día. Antes de que la noche termine, será visitado por un desconcertante taxista neoyorquino del pasado, un hada del presente un tanto estrafalaria y, finalmente, un sádico, enorme y descabezado mensajero del futuro.",,https://www.themoviedb.org/movie/9647-scrooged/watch?locale=ES
Searching,Michael Jackson: Searching for Neverland,plot twist,2017,102,"Drama, Película de TV",6.591,Dianne Houston,en,United States of America,"Basado en el best-seller, Remember the Time: Protecting Michael Jackson in His Final Days, y contado a través de los ojos de los guardaespaldas de confianza de Jackson, Bill Whitfield y Javon Beard. La película revelará de primera mano la devoción que Michael Jackson tuvo por sus hijos y el drama oculto que tuvo lugar durante los últimos dos años de su vida.",,
Secondhand lions,El secreto de los McCann,,2003,109,"Familia, Comedia, Drama",7.211,Tim McCanlies,en,United States of America,"Cuenta las cómicas aventuras de un chico introvertido obligado a pasar el verano en una rancho de Texas con sus excéntricos tíos, dos señores mayores a los que apenas conoce, la idea no le hace ninguna gracia. Y la verdad es que a los dos hombres tampoco les excita mucho la idea de cuidar del chaval, pero éste descubre que sus tíos viven una vida nada convencional, incluso peligrosa, y sus historias despiertan la imaginación y las ganas de aventuras del tímido joven.",,https://www.themoviedb.org/movie/13156-secondhand-lions/watch?locale=ES
Senior Moment,Senior Moment,LGTB,2021,92,"Comedia, Romance",5.63,Giorgio Serafini,en,,"Después de participar en una carrera con su convertible vintage por Palm Springs, un piloto de la NASA retirado pierde su carnet de conducir. Obligado a usar el transporte público, conoce a Caroline y aprende a disfrutar del amor y la vida otra vez.","Amazon Prime Video, Amazon Prime Video with Ads",https://www.themoviedb.org/movie/762888-senior-moment/watch?locale=ES
Servant,Bang-Jeon,Serie,2010,124,"Romance, Drama, Comedia",5.671,Kim Dae-woo,ko,South Korea,"Un sirviente se enamora de una chica que su amo también desea. Aunque la chica ama al sirviente, también anhela mejorar su posición en la vida.",,
Session 9,Session 9,plot twist,2001,100,"Terror, Misterio, Drama",6.1,Brad Anderson,en,United States of America,"Hace quince años que el Hospital Mental de Danvers (Massachussetts), que se levanta amenazador en medio de un bosque, ha sido cerrado, y los vecinos procuran mantenerse alejados del lugar. Gordon Fleming (Peter Mullan), un emigrante escocés que posee y dirige Hazmat Elimination Co., necesita urgentemente conseguir el contrato para retirar los peligrosos residuos de amianto del hospital. Con tal de cerrar el acuerdo, Gordon, imprudentemente, promete al ingeniero local Bill Griggs (Paul Guilfoyle) que el trabajo durará sólo una semana. Una vez firmado el contrato, los hombres de Hazmat se adentran en los vastos y espeluznantes salones y pasillos del hospital. A medida que pasa el tiempo, el equipo se siente cada vez más arrastrado por los misterios que rodean al hospital.",,https://www.themoviedb.org/movie/10972-session-9/watch?locale=ES
"Sexo, mentiras y cintas de video","Sexo, mentiras y cintas de vídeo",101,1989,98,Drama,6.941,Steven Soderbergh,en,United States of America,"John, un abogado yuppie, con pocos escrúpulos, está casado con Ann, una mujer seria e introvertida. Ella, aunque muestra poco interés por el sexo, se siente segura de su matrimonio. John, en cambio, es un adicto al sexo y tiene una aventura con Cinthia, la extrovertida y desenfadada hermana de Ann. La llegada del enigmático Graham, un antiguo compañero de John en la universidad, alterará la vida de Ann",Filmin,https://www.themoviedb.org/movie/1412-sex-lies-and-videotape/watch?locale=ES
Sf8,간호중,koreana estilo black mirror,2021,79,Ciencia ficción,6.3,Min Kyu-dong,ko,South Korea,,,
Shadowhunters: The Mortal Instruments,Cazadores de sombras: Ciudad de hueso,,2013,130,"Fantasía, Acción, Misterio",6.428,Harald Zwart,en,"Canada, Germany, United Kingdom, United States of America","Clary Fray es una adolescente ordinaria de Brooklyn hasta la noche que conoce al misterioso chico de los tatuajes Jace, quién resulta ser un guerrero medio ángel conocido como cazador de sombras. Cuando Clary descubre que su madre Jocelyn ha sido raptada, desesperadamente espera que Jace pueda ayudarla. Después de entrar en un portal dorado que la transporta a través del tiempo y espacio en un latido de corazón, Clary se da cuenta que ella también tiene poderes para los cazadores de sombras. ¿Pero puede aprovecharlos a tiempo para salvar a su madre?",Lionsgate+ Amazon Channels,https://www.themoviedb.org/movie/123553-the-mortal-instruments-city-of-bones/watch?locale=ES
Shakespeare enamorado,Shakespeare enamorado,26,1998,123,"Romance, Historia, Comedia",6.835,John Madden,en,United States of America,"Londres, 1593, reinado de Isabel I Tudor. William Shakespeare, joven dramaturgo de gran talento, necesita urgentemente poner fin a la mala racha por la que está pasando su carrera. Por mucho que lo intenta, y a pesar de la presión de los productores y de los dueños de salas de teatro, no consigue concentrarse en su nueva obra: ""Romeo y Ethel, la hija del pirata"". Lo que Will necesita es una musa y la encontrará en la bella Lady Viola, con la que mantiene un romance secreto. Ahora bien, Lady Viola guarda dos secretos que él debe descubrir.",,https://www.themoviedb.org/movie/1934-shakespeare-in-love/watch?locale=ES
She dies tomorrow,She Dies Tomorrow,,2020,85,Drama,5.094,Amy Seimetz,en,United States of America,"La mente de Amy ha sido invadida por la idea de que va a morir al día siguiente, lo cual le lleva a caer a través de una vertiginosa espiral emocional. Cuando su escéptica amiga Jane descubre que el sentimiento de muerte inminente que Amy experimenta es contagioso, ambas comienzan su propio y extraño viaje durante el día que podría ser el último de sus vidas.",Filmin,https://www.themoviedb.org/movie/664297-she-dies-tomorrow/watch?locale=ES
Shutter,Shutter Island,plot twist,2010,138,"Drama, Suspense, Misterio",8.198,Martin Scorsese,en,United States of America,"Verano de 1954. Los agentes judiciales Teddy Daniels y Chuck Aule son destinados a una remota isla del puerto de Boston para investigar la desaparición de una peligrosa asesina recluida en el hospital psiquiátrico Ashecliffe, un centro penitenciario para criminales perturbados dirigido por el siniestro doctor John Cawley. Pronto descubrirán que el centro guarda muchos secretos, y que la isla esconde algo más peligroso que los pacientes.","Movistar Plus+, Amazon Prime Video, Amazon Prime Video with Ads, Movistar Plus+ Ficción Total , Netflix Standard with Ads, Netflix",https://www.themoviedb.org/movie/11324-shutter-island/watch?locale=ES
Sin city,Sin City: Una dama por la que matar,,2014,102,"Acción, Crimen, Suspense",6.403,Robert Rodriguez,en,United States of America,"En las sórdidas calles de Sin City, un hombre busca su venganza. Dwight trata de ajustar cuentas con la misteriosa Ava Lord, la letal mujer que le traicionó. Nancy intenta superar la muerte de Hartigan, y Johny tiene una peligrosa misión: acabar con el mayor villano de Sin City. En su propósito, conocerá a la joven stripper Marcy.",,
Sin perdón,Sin perdón,31,1992,131,Western,7.912,Clint Eastwood,en,United States of America,"William Munny es un pistolero retirado, viudo y padre de familia, que tiene dificultades económicas para sacar adelante a su hijos. Su única salida es hacer un último trabajo. En compañía de un viejo colega y de un joven inexperto, Munny tendrá que matar a dos hombres que cortaron la cara a una prostituta.","Movistar Plus+ Ficción Total , Movistar Plus+, Tivify, Filmin",https://www.themoviedb.org/movie/33-unforgiven/watch?locale=ES
Slap,El castañazo,,1977,122,"Comedia, Drama",6.778,George Roy Hill,en,United States of America,"Un veterano jugador que entrena a un equipo de hockey sobre hielo (Newman) ve cómo las derrotas se suceden hasta que decide aplicar la más brutal de las tácticas: aconseja a sus jugadores que jueguen como verdaderos animales durante los partidos, sin importar si la violencia que emplean es o no legal. Divertida y muy bien interpretada, fue duramente criticada en su estreno por su violento -y extremadamente liberal- mensaje.",,https://www.themoviedb.org/movie/11590-slap-shot/watch?locale=ES
Sleep with Me,Duerme conmigo,LGTB,1994,86,"Comedia, Drama, Romance",5.7,Rory Kelly,en,"United Kingdom, United States of America",Tres buenos amigos ven enturbiada su relación a causa de sus sentimientos amorosos y la permanente amenaza de un agridulce triángulo amoroso. Sólo el recuerdo de su amistad y de los buenos tiempos compartidos podrá salvar las relaciones...,,
Sleepaway camp,Campamento sangriento,plot twist,1983,85,Terror,6.283,Robert Hiltzik,en,United States of America,Un grupo de adolescentes que acuden a un campamento de verano comenzarán a ser asesinados uno a uno.,Filmin,https://www.themoviedb.org/movie/13567-sleepaway-camp/watch?locale=ES
Slums of beverly hills,Colgados en Beverly Hills,,1998,93,"Comedia, Drama",6.294,Tamara Jenkins,en,United States of America,"Es el año 1976, en plena era del progresismo, el amor libre y la libertad. Es también el año en el que Vivian Abromowitz comienza a madurar, aunque su padre divorciado no se lo pone fácil. Uno de sus empeños es que tanto ella como sus dos hermanos acaben sus estudios en el instituto Beverly Hills.",,
Snowpiercer,Rompenieves,,2013,126,"Acción, Ciencia ficción, Drama",6.9,Bong Joon Ho,ko,South Korea,"Un experimento para solucionar el calentamiento global acabó con la mayoría de vida existente en el planeta. El último tren llamado Snowpiercer (Rompenieves) se mueve en círculos por el mundo, a través de un desierto de hielo y nieve. Los últimos supervivientes de la Tierra se amontonan en sus vagones. El joven Curtis (Chris Evans) iniciará una revolución desde los vagones de cola.","Amazon Prime Video, Amazon Prime Video with Ads, Filmin",https://www.themoviedb.org/movie/110415/watch?locale=ES
Sobran las palabras,Sobran las palabras,,2026,105,"Música, Drama, Comedia",6.842,Luca Ribuoli,it,Italy,"Tras descubrir su talento para el canto, una tímida adolescente que es la única persona no sorda de su familia deberá elegir entre cumplir con su deber o seguir su propio camino.","Netflix Standard with Ads, Netflix",https://www.themoviedb.org/movie/1620551-non-abbiam-bisogno-di-parole/watch?locale=ES
Solaris,Solaris,,2002,94,"Drama, Ciencia ficción, Misterio",5.953,Steven Soderbergh,en,United States of America,"Cuando el Doctor Chris Kelvin recibe una llamada de socorro proveniente de una base espacial situada junto al planeta Solaris, emprende un viaje hacia lo desconocido de consecuencias imprevisibles para su futuro. Una vez en la base, comprueba que sólo hay dos supervivientes.",,https://www.themoviedb.org/movie/2103-solaris/watch?locale=ES
Solo,Solo Leveling: ReAwakening,,2024,116,"Acción, Aventura, Fantasía, Animación",7.16,Shunsuke Nakashige,ja,Japan,"Ha pasado más de una década desde que un camino llamado ""portal"" que conecta este mundo con una dimensión alternativa apareció de repente, y personas con poderes sobrehumanos llamados ""cazadores"" han despertado. Los cazadores usan sus poderes sobrehumanos para conquistar mazmorras dentro de los portales para ganarse la vida y Sung Jinwoo, un cazador del rango más bajo, es considerado como el Cazador Más débil de Toda la Humanidad. Un día se encuentra con una mazmorra doble, una mazmorra de alto nivel oculta dentro de una de bajo nivel. Frente a un Jinwoo gravemente herido, surge una misteriosa ventana hacia una misión. Al borde de la muerte, Jinwoo decide encargarse de la misión, que le convierte en la única persona capaz de subir de nivel. Largometraje formado por una recapitulación de la primera temporada de la serie de anime homónima junto con un avance exclusivo de los dos primeros episodios de la segunda temporada.",,
